{
  "schema": "lifecycle.atlas-resolution.v2",
  "selection": {
    "release": "0.7.0",
    "specificationRevision": "429fee62966f4d30e91ec2a15d27ecf353f5d68f",
    "authoredFormat": 1,
    "processorRevision": "746cbce73c51b28d617b96ca08f18d498ac749c4",
    "validationProfile": "neutral.atlas-validator.resolved",
    "validationResultSchema": "urn:atlas:schema:validation-result:1",
    "normalizedModelSchema": "urn:atlas:schema:normalized:1",
    "consumerProfile": "lifecycle.atlas-consumer.v1"
  },
  "atlasStateDigest": "sha256:1111111111111111111111111111111111111111111111111111111111111111",
  "resourceBindings": [
    {
      "resourceId": "resource-local",
      "uri": "../README.md",
      "path": "README.md",
      "mode": "100644",
      "objectId": "2222222222222222222222222222222222222222",
      "byteDigest": "sha256:5555555555555555555555555555555555555555555555555555555555555555",
      "disposition": "resolved"
    },
    {
      "resourceId": "resource-missing",
      "uri": "missing.md",
      "path": "atlas/missing.md",
      "mode": null,
      "objectId": null,
      "byteDigest": null,
      "disposition": "missing"
    },
    {
      "resourceId": "resource-network",
      "uri": "https://example.test/context.md",
      "path": null,
      "mode": null,
      "objectId": null,
      "byteDigest": null,
      "disposition": "retrieval-denied"
    },
    {
      "resourceId": "resource-path-invalid",
      "uri": "../..",
      "path": null,
      "mode": null,
      "objectId": null,
      "byteDigest": null,
      "disposition": "path-invalid"
    },
    {
      "resourceId": "resource-unreadable",
      "uri": "executable.md",
      "path": "atlas/executable.md",
      "mode": null,
      "objectId": null,
      "byteDigest": null,
      "disposition": "unreadable"
    }
  ],
  "resourceBindingsDigest": "sha256:1dbcdb0b32d48c9c11ad39507ae07751195490267811b6cf3aef3bd2c73d1ec5",
  "processor": {
    "id": "atlas-reference-validator",
    "version": "0.7.0",
    "implementationDigest": "sha256:94e8a97eda6659327fd6ec34ae2764787326962c0b2bf0eec39a236ca70d0205"
  },
  "externalValidationResultDigest": "sha256:3333333333333333333333333333333333333333333333333333333333333333",
  "normalizedModelDigest": "sha256:4444444444444444444444444444444444444444444444444444444444444444",
  "complete": true,
  "valid": true,
  "digest": "sha256:c44130b1dd541fd6c72c6044d38f654da6cf0700258c6f61ed21e31960fcf07f"
}
